{"$schema":"https://json-schema.org/draft/2020-12/schema","$id":"https://schemas.dromio.dev/backup-purge-ledger-entry/v1.schema.json","type":"object","additionalProperties":false,"required":["schemaVersion","id","tenantId","applicationId","threadId","purgeReceipt","backupExpiresAt","recordedAt"],"properties":{"schemaVersion":{"const":"dromio.backup-purge-ledger-entry.v1"},"id":{"type":"string","minLength":1},"tenantId":{"type":"string","minLength":1},"applicationId":{"type":"string","minLength":1},"threadId":{"type":"string","minLength":1},"purgeReceipt":{"$ref":"https://schemas.dromio.dev/purge-receipt/v1.schema.json"},"backupExpiresAt":{"type":"string","format":"date-time"},"recordedAt":{"type":"string","format":"date-time"}}}
