{"schemaVersion":"dromio.backup-purge-ledger-entry.v1","id":"ledger-1","tenantId":"tenant-1","applicationId":"app-1","threadId":"thread-1","purgeReceipt":{"schemaVersion":"dromio.purge-receipt.v1","id":"purge-1","tenantId":"tenant-1","applicationId":"app-1","threadId":"thread-1","deletedResources":{},"propagationTargets":["context"],"propagation":{"context":{"status":"completed","completedAt":"2026-01-01T00:00:01Z"}},"status":"completed","purgedAt":"2026-01-01T00:00:00Z","completedAt":"2026-01-01T00:00:01Z","purgedBy":{"type":"system","id":"purger"}},"backupExpiresAt":"2026-02-01T00:00:00Z","recordedAt":"2026-01-01T00:00:01Z"}
